{
	"$schema": "https://json-schema.org/draft/2020-12/schema",
	"type": "object",
	"properties": {
		"id": {
			"type": "string",
			"pattern": "^[a-z0-9][a-z0-9-]*$"
		},
		"name": {
			"type": "string",
			"minLength": 1
		},
		"version": {
			"type": "integer",
			"exclusiveMinimum": 0,
			"maximum": 9007199254740991
		},
		"language_pair": {
			"type": "string",
			"pattern": "^[a-z]{2}(-[a-z]{2})?$"
		},
		"description": {
			"type": "string"
		},
		"lessons": {
			"minItems": 1,
			"type": "array",
			"items": {
				"type": "object",
				"properties": {
					"id": {
						"type": "string",
						"pattern": "^[a-z0-9][a-z0-9-]*$"
					},
					"title": {
						"type": "string"
					},
					"sort_order": {
						"type": "integer",
						"minimum": 0,
						"maximum": 9007199254740991
					},
					"vocabulary": {
						"minItems": 1,
						"type": "array",
						"items": {
							"type": "object",
							"properties": {
								"word": {
									"type": "string",
									"minLength": 1
								},
								"pinyin": {
									"type": "string"
								},
								"translation": {
									"type": "string",
									"minLength": 1
								}
							},
							"required": [
								"word",
								"translation"
							],
							"additionalProperties": false
						}
					}
				},
				"required": [
					"id",
					"sort_order",
					"vocabulary"
				],
				"additionalProperties": false
			}
		}
	},
	"required": [
		"id",
		"name",
		"version",
		"language_pair",
		"lessons"
	],
	"additionalProperties": false
}
